,id,username,text,retweet_count,like_count,created_at
0,1624436510643863552,HeyBudie,"Dibilang jauh tidak, dibilang dekat juga tidak mungkin.",231,1075,2023-02-11 15:53:39+00:00
1,1624051782409125890,HeyBudie,"Kadang maunya sendiri, kadang maunya ditemani.",598,2797,2023-02-10 14:24:53+00:00
2,1623690801476939776,HeyBudie,"Bilangnya tidak dekat dengan siapa-siapa, ternyata ada hati yang harus dijaga.",500,3013,2023-02-09 14:30:28+00:00
3,1623686373747326977,HeyBudie,"Gampang suka, sulit memilikinya.",423,2191,2023-02-09 14:12:52+00:00
4,1623355760393732096,HeyBudie,"Bilangnya gapapa, tapi ngetiknya sambil nyesek luar biasa.",1056,4120,2023-02-08 16:19:08+00:00
5,1623286056392208384,HeyBudie,"Tetiba tercium aroma parfumnya, padahal sudah lama tak bersama.",475,3087,2023-02-08 11:42:09+00:00
6,1623255694945456129,HeyBudie,"Sama seperti dulu, berharap pada orang yang keliru.",294,1499,2023-02-08 09:41:30+00:00
7,1623008902697873409,HeyBudie,Kangenmu berujung dibales stiker.,176,1331,2023-02-07 17:20:51+00:00
8,1622927995500658691,HeyBudie,"Setidaknya pernah sat-set, meski sekarang dia ke kamu males banget.",300,1527,2023-02-07 11:59:21+00:00
9,1622617275726712833,HeyBudie,"Males balas chat, kalau dari dia enggak.",539,2387,2023-02-06 15:24:39+00:00
10,1622586199385968641,HeyBudie,Menyenangkan bila dekatnya bisa diulang.,576,2294,2023-02-06 13:21:10+00:00
11,1622260866933727233,HeyBudie,"Berhasil membuat dia tertawa, tapi tidak berhasil membuat dia suka.",576,3160,2023-02-05 15:48:25+00:00
12,1621919071968305152,HeyBudie,"Kamu sering kangen, dia sudah bosen.",882,4192,2023-02-04 17:10:15+00:00
13,1621897506841042947,HeyBudie,"Cuma penasaran, nggak usah berharap berlebihan.",364,1668,2023-02-04 15:44:33+00:00
14,1621558069267398656,HeyBudie,Tidak menanyakanmu bukan berarti tidak kangen kamu.,1704,5928,2023-02-03 17:15:45+00:00
15,1621154692893151235,HeyBudie,Loh sudah nggak dekat lagi ya?,1366,8228,2023-02-02 14:32:53+00:00
16,1621112434919604225,HeyBudie,"Nggak benci, nggak pergi, dan nggak bisa bersama lagi.",579,2597,2023-02-02 11:44:57+00:00
17,1620696995446009857,HeyBudie,"Jika Januari kemarin banyak capeknya, semoga Februari ini banyak pemasukannya.",702,3058,2023-02-01 08:14:09+00:00
18,1620443500235087873,HeyBudie,"Bertahan sakit, beranjak pergi sulit.",814,3283,2023-01-31 15:26:51+00:00
19,1620360892629258245,HeyBudie,"Nggak perlu ditunggu, meski dia sudah buka hati juga belum tentu untukmu.",210,958,2023-01-31 09:58:36+00:00
20,1620305668606664706,HeyBudie,"Terbiasa sendiri, tapi tak terbiasa dengan sepi.",837,2890,2023-01-31 06:19:09+00:00
21,1620091540466171906,HeyBudie,"Dia selalu perhatian, tapi cuma dianggap teman.",192,1219,2023-01-30 16:08:17+00:00
22,1620074215406968833,HeyBudie,"Meski sikapmu dingin, kuharap kau tak berpaling.",233,1128,2023-01-30 14:59:27+00:00
23,1619725468286226439,HeyBudie,"Nggak tenggelam, tapi chatmu didiamkan.",890,4626,2023-01-29 15:53:39+00:00
24,1619379426684456960,HeyBudie,Hehe kangen.,1216,3144,2023-01-28 16:58:36+00:00
25,1619342313490366464,HeyBudie,Semakin hari semakin terasa sepi.,943,2994,2023-01-28 14:31:08+00:00
26,1619003384207663105,HeyBudie,"Biasanya selalu ngabarin, sekarang nggak pernah ada kabar.",646,2986,2023-01-27 16:04:21+00:00
27,1618971833310810113,HeyBudie,"Sudah tau kalau dia bakalan pergi, kamu malah nyaman lagi.",883,4223,2023-01-27 13:58:58+00:00
28,1618845333664182272,HeyBudie,"Sengaja react story biar ada obrolan lagi, ternyata dia tetap nggak peduli.",220,1628,2023-01-27 05:36:18+00:00
29,1618622103095513089,HeyBudie,"Dia tidak lupa, mungkin sudah malas denganmu saja.",1824,6721,2023-01-26 14:49:16+00:00
30,1618295181291433984,HeyBudie,Kalau dipikir-pikir dia nggak bakalan naksir.,277,1294,2023-01-25 17:10:12+00:00
31,1618267036005859329,HeyBudie,"Sudah tau nyesek, tapi masih dicari tau.",1790,7004,2023-01-25 15:18:21+00:00
32,1618244819595456513,HeyBudie,"Balasnya lama, jawabnya begitu saja.",1195,4732,2023-01-25 13:50:05+00:00
33,1617921761257091073,HeyBudie,"Dia tau, tapi dia tidak ada rasa denganmu.",1772,6461,2023-01-24 16:26:22+00:00
34,1617903571097485313,HeyBudie,"Sudah saling bertukar cerita, malah nggak bisa bersama.",742,3165,2023-01-24 15:14:05+00:00
35,1617874463533731847,HeyBudie,"Kukira dia nggak suka, ternyata emang iya.",472,2159,2023-01-24 13:18:25+00:00
36,1617517191867551745,HeyBudie,"Siang bisa sendiri, malam maunya ditemani.",678,2882,2023-01-23 13:38:45+00:00
37,1617192790206853121,HeyBudie,"Mudah datang, mudah hilang.",1224,4593,2023-01-22 16:09:41+00:00
38,1616829909690904577,HeyBudie,"Sudah jauh, tapi masih berharap seperti dulu.",949,3624,2023-01-21 16:07:44+00:00
39,1616786855940485120,HeyBudie,"Nanya mulu, ditanyain balik juga enggak.",366,2032,2023-01-21 13:16:39+00:00
40,1616733414719381507,HeyBudie,"Sudah banyak hari berlalu, namun perasaannya tak pernah tumbuh untukmu.",152,1078,2023-01-21 09:44:18+00:00
41,1616439890551635970,HeyBudie,"Katanya bersama, tapi kok ngerasa sendirian.",790,3360,2023-01-20 14:17:56+00:00
42,1616307758575538176,HeyBudie,"Nggak perlu ditunggu, dia nggak ada perasaan ke kamu.",2197,9170,2023-01-20 05:32:53+00:00
43,1616052902799495170,HeyBudie,"Orangnya denganmu, perasaannya dengan yang dulu.",920,5366,2023-01-19 12:40:11+00:00
44,1616033054249844736,HeyBudie,Lagi-lagi diri sendiri yang berharap lebih.,1105,3448,2023-01-19 11:21:19+00:00
45,1615759264282456069,HeyBudie,"Masih teringat, padahal singkat dan cepat.",433,1429,2023-01-18 17:13:22+00:00
46,1615727679046815744,HeyBudie,"Yang berharap kamu, yang capek kamu.",1207,4240,2023-01-18 15:07:52+00:00
47,1615723069989097472,HeyBudie,"Sudah fokus satu, ternyata bukan yang dia mau.",444,1957,2023-01-18 14:49:33+00:00
48,1615359583488471040,HeyBudie,"Berani kangen, takut bilang.",1144,4753,2023-01-17 14:45:11+00:00
49,1615340123868262403,HeyBudie,"Dikira ada yang baru, ternyata dia bosan denganmu.",193,1073,2023-01-17 13:27:51+00:00
50,1615230671437574145,HeyBudie,"Tanpa dia kamu belum terbiasa, tanpa kamu dia baik-baik saja.",1269,4479,2023-01-17 06:12:56+00:00
51,1615024184316538881,HeyBudie,"Cuma jadi tempat dia curhat, bukan yang diharap.",188,1024,2023-01-16 16:32:25+00:00
52,1614959149040955392,HeyBudie,"Nyesek sendirian, ekspektasimu terlalu berlebihan.",1362,4761,2023-01-16 12:14:00+00:00
53,1614914933522857986,HeyBudie,"Jangan diteruskan, kan dia nggak ada perasaan.",1686,6567,2023-01-16 09:18:18+00:00
54,1614632832277843969,HeyBudie,"Terlalu berharap lebih, malah kecewa lagi.",743,2333,2023-01-15 14:37:20+00:00
55,1614617191311343616,HeyBudie,"Namanya juga bukan prioritas lagi, dia balasnya beberapa hari.",360,1965,2023-01-15 13:35:11+00:00
56,1614286087488438273,HeyBudie,"Giliran ada yang mendekati, kamu malah ingin sendiri.",1087,5636,2023-01-14 15:39:29+00:00
57,1614262790180700164,HeyBudie,"Susah kalau maunya harus dia, padahal sudah tahu kalau nggak bisa bersama.",2023,6701,2023-01-14 14:06:55+00:00
58,1613949807252639745,HeyBudie,Kangen dia yang nggak kangen.,1794,5769,2023-01-13 17:23:14+00:00
59,1613903696320155651,HeyBudie,"Bilangnya tidak peduli, giliran dia menghampiri kamu luluh lagi.",2498,12154,2023-01-13 14:20:00+00:00
60,1613865846241366016,HeyBudie,Meski selalu ada juga bukan yang diharapkannya.,207,993,2023-01-13 11:49:36+00:00
61,1613825311564795904,HeyBudie,"Ngereadnya cepat, balasnya kalau sempat.",208,1514,2023-01-13 09:08:32+00:00
62,1613555033366491138,HeyBudie,"Jadi saling diam, nggak ada lagi obrolan.",1603,6579,2023-01-12 15:14:33+00:00
63,1613527097397637120,HeyBudie,Menjaga hati untuk dia yang belum tentu mau denganmu.,919,4223,2023-01-12 13:23:32+00:00
64,1613192681999699970,HeyBudie,"Nggak perlu ditungguin, kan dia nggak bisa dimilikin.",917,3663,2023-01-11 15:14:41+00:00
65,1613113915969515520,HeyBudie,"Padahal cuacanya panas, tapi dia masih dingin.",152,859,2023-01-11 10:01:42+00:00
66,1613097400209649665,HeyBudie,"Jangan dipaksa, kan tanpamu dia terlihat baik-baik saja.",2665,8900,2023-01-11 08:56:04+00:00
67,1612845358761250816,HeyBudie,"Bilangnya gapapa, tapi banyak nangisnya.",6681,17222,2023-01-10 16:14:33+00:00
68,1612797959858696193,HeyBudie,"Jangan khawatir, ke kamu dia juga nggak mikir.",344,1603,2023-01-10 13:06:12+00:00
69,1612479404906778624,HeyBudie,"Kangennya masih bersama, orangnya sudah pergi lama.",310,1564,2023-01-09 16:00:23+00:00
70,1612465781610270721,HeyBudie,"Sengaja salah kirim, tapi nggak dia tanggapin.",166,1429,2023-01-09 15:06:15+00:00
71,1612446497588772865,HeyBudie,Kalau dilihat-lihat emang dia nggak minat.,1706,8166,2023-01-09 13:49:37+00:00
72,1612092785993330689,HeyBudie,Nggak semua yang menghampiri berujung mengisi.,451,1860,2023-01-08 14:24:06+00:00
73,1612079538489655296,HeyBudie,"Bisa sendiri, tapi ingin juga ditemani.",4795,13597,2023-01-08 13:31:27+00:00
74,1612017215410425856,HeyBudie,"Lucu, tiba-tiba jadi jauh.",7228,25614,2023-01-08 09:23:48+00:00
75,1611793231205007361,HeyBudie,"""Iya, aku juga kangen kamu""
Berharap dia jawab begitu.",512,2250,2023-01-07 18:33:46+00:00
76,1611746012858830848,HeyBudie,"Ada yang saling bertukar pesan, tapi nggak saling bertukar perasaan.",745,4297,2023-01-07 15:26:08+00:00
77,1611700462776115201,HeyBudie,"Maunya terus bersama, padahal juga bukan siapa-siapanya.",951,4498,2023-01-07 12:25:08+00:00
78,1611346627121512449,HeyBudie,"Diminta melepasmu, padahal juga belum memilikimu.",1697,8176,2023-01-06 12:59:07+00:00
79,1611334607236132864,HeyBudie,Maafin kalau kamu yang selalu aku harapin.,836,3298,2023-01-06 12:11:22+00:00
80,1611027968515768320,HeyBudie,"Bersama seakan asing, dilepas seakan tak ingin.",619,2646,2023-01-05 15:52:53+00:00
81,1610995816285769734,HeyBudie,"Kalau dipikir-pikir emang cuma diri sendiri yang terlalu berharap lebih, dia tidak sama sekali.",2064,8043,2023-01-05 13:45:08+00:00
82,1610683815340695554,HeyBudie,"Tetap stalking, meski nggak pernah chatting.",2519,13156,2023-01-04 17:05:21+00:00
83,1610651801279434755,HeyBudie,Mungkin masih sibuk dengan yang lain.,240,1294,2023-01-04 14:58:08+00:00
84,1610537498534633473,HeyBudie,"Kan cuma teman,
teman gabutnya lagi.",1669,8988,2023-01-04 07:23:56+00:00
85,1610296248581656576,HeyBudie,"Kangen, tapi enggan memulai duluan.",1741,7971,2023-01-03 15:25:18+00:00
86,1610274134210277376,HeyBudie,"Nggak mau orang yang baru, nggak mau dia yang dulu.",469,2326,2023-01-03 13:57:25+00:00
87,1610122436242210821,HeyBudie,"kukira yang dia mau, ternyata hanya sekadar perlu.",629,2853,2023-01-03 03:54:38+00:00
88,1609928838250889216,HeyBudie,"Kemarin peduli, sekarang seperti tak mengenal lagi.",809,3500,2023-01-02 15:05:20+00:00
89,1609908145681498113,HeyBudie,"Pura-pura tidak mencari, meski masih berharap bisa seperti dulu lagi.",3041,11597,2023-01-02 13:43:07+00:00
90,1609880850686160898,HeyBudie,"Bertemunya lewat mimpi, kangennya nyata.",2093,9465,2023-01-02 11:54:39+00:00
91,1609784316934098944,HeyBudie,"Wow! Selamat pemenang!

1. @akujuarakedua
2. @lianalianaku
3. @rkiveprojext99 
4. @adventurose_
5. @andinimayang31… https://t.co/UUXzsSJhab",3,16,2023-01-02 05:31:04+00:00
92,1609528997414850561,HeyBudie,"Maaf salah sangka, kukira beneran suka
ternyata aku hanya kegeeran saja.",1663,8996,2023-01-01 12:36:31+00:00
93,1609452315337183233,HeyBudie,"Tidak jauh, namun tidak bisa dekat lagi.",2852,10937,2023-01-01 07:31:48+00:00
94,1609234813302738945,HeyBudie,"Selamat tahun baru, meski dia tak ingin denganmu.",158,739,2022-12-31 17:07:32+00:00
95,1609184187617275904,HeyBudie,"Rame banget, tapi notif tetap sepi.",120,749,2022-12-31 13:46:22+00:00
96,1609138949183897601,HeyBudie,3 kata untuk 2022,17,466,2022-12-31 10:46:36+00:00
97,1608812503768903680,HeyBudie,"Kamu pura-pura biasa, dia pura-pura suka.",910,6089,2022-12-30 13:09:25+00:00
98,1608768912560369667,HeyBudie,"GIVEAWAY E-wallet total 1jt buat 5 org!
Caranya gampang, karena yg sulit itu dapatin dia

- Follow @seatodaynews
-… https://t.co/OsdGTyKEWJ",181,290,2022-12-30 10:16:12+00:00
99,1608713372924805120,HeyBudie,"Sewajarnya saja, nggak terlalu mengharapkannya.",1302,5206,2022-12-30 06:35:31+00:00
100,1608496716092936194,HeyBudie,"Tanpa kabarmu dia juga biasa-biasa aja gitu, nggak ngaruh.",2586,13081,2022-12-29 16:14:36+00:00
101,1608305737033302018,HeyBudie,Penasarannya sudah selesai ya?,2383,10822,2022-12-29 03:35:43+00:00
102,1608266848025612289,HeyBudie,"Tahu-tahu ketemu lagi dengan tahun baru, padahal masih kangen dengan orang yang menemani di tahun lalu.

Rencanamu… https://t.co/tYCvJLnyta",15,151,2022-12-29 01:01:11+00:00
103,1608101532221984769,HeyBudie,"Bilangnya kesepian, giliran ditemani malah maunya sendirian.",600,3812,2022-12-28 14:04:17+00:00
104,1608084167115550721,HeyBudie,"Hujannya awet, chatmu cuek.",941,5886,2022-12-28 12:55:16+00:00
105,1608066574979829761,HeyBudie,"Kangen, tapi tidak ingin mencari tahu.",4135,15311,2022-12-28 11:45:22+00:00
106,1607747863152578562,HeyBudie,"Semakin hari semakin dingin,
chatmu.",1127,6165,2022-12-27 14:38:55+00:00
107,1607399365244784641,HeyBudie,Kok obrolanmu dengan dia tiba-tiba berhenti begitu saja,1345,10203,2022-12-26 15:34:07+00:00
108,1607334262885478400,HeyBudie,"Badan diam, pikiran berantakan.",4010,10174,2022-12-26 11:15:25+00:00
109,1607226679218573312,HeyBudie,Menjadi dewasa ternyata begini yaa rasanya.,920,2988,2022-12-26 04:07:55+00:00
110,1607044379780481028,HeyBudie,"Terlalu singkat, namun selalu diingat.",2470,8728,2022-12-25 16:03:32+00:00
111,1607030923794747392,HeyBudie,Terbiasa pura-pura gapapa.,1718,5085,2022-12-25 15:10:04+00:00
112,1606981845924843521,HeyBudie,"Tangis tak bersuara, namun pedihnya terasa.",1780,5968,2022-12-25 11:55:03+00:00
113,1606885924864135168,HeyBudie,"Baru dekat
sudah terlalu berharap.",790,4307,2022-12-25 05:33:53+00:00
114,1606682561551699970,HeyBudie,"Dulu selalu ngobrol hingga larut malam, sekarang malah saling diam.",2309,9711,2022-12-24 16:05:48+00:00
115,1606671601323618304,HeyBudie,"Kamu malah suka kalau dia gabut, karena larinya pasti ke kamu.",339,2632,2022-12-24 15:22:14+00:00
116,1606619595242369024,HeyBudie,Meski sering menemani ternyata belum tentu  jadi yang dia pilih.,830,3488,2022-12-24 11:55:35+00:00
117,1606537520325754881,HeyBudie,"Masih sering nungguin, meski tahu kalau bukan yang diharapin.",961,4174,2022-12-24 06:29:27+00:00
118,1606312429192810497,HeyBudie,"Kamu kira dia akan bersandar, ternyata menghindar.",331,1723,2022-12-23 15:35:01+00:00
119,1606295027189026816,HeyBudie,Yang diharapkan malah suka hilang.,1083,4885,2022-12-23 14:25:52+00:00
120,1606234332133064705,HeyBudie,"Gatau inginnya apa, yang jelas dia tidak menginginkanmu.",876,4203,2022-12-23 10:24:41+00:00
121,1605942302517514241,HeyBudie,Mulai dingin dan terlihat tak ingin.,2756,11455,2022-12-22 15:04:16+00:00
122,1605923770375360513,HeyBudie,"Sudah panjang lebar cerita, malah nggak ada responnya.",1990,10628,2022-12-22 13:50:38+00:00
123,1605919372719046657,HeyBudie,"Kamu masih belum terbiasa, meski dia sudah lama pindah.",263,1351,2022-12-22 13:33:09+00:00
124,1605890878370770944,HeyBudie,Untuk apa orang baru jika maunya masih denganmu.,708,3412,2022-12-22 11:39:56+00:00
125,1605795453655621633,HeyBudie,Denganmu dia banyak bercandanya daripada sukanya.,202,1439,2022-12-22 05:20:45+00:00
126,1605567295841091584,HeyBudie,"Seperti diberi harapan, tapi juga sering diabaikan.",2393,8238,2022-12-21 14:14:07+00:00
127,1605525178028421120,HeyBudie,Sedih sudah nggak chat intens lagi.,1635,7530,2022-12-21 11:26:46+00:00
128,1605438222758133762,HeyBudie,"Pernah membuatmu seru, meski sekarang dia menjauh.",321,1608,2022-12-21 05:41:14+00:00
129,1605227174499610624,HeyBudie,"Bahagianya sementara, sedihnya nggak kira-kira.",2095,7566,2022-12-20 15:42:36+00:00
130,1605205714095730688,HeyBudie,"Jangankan jadi penonton story, kontak saja sudah nggak disimpan lagi.",425,2452,2022-12-20 14:17:20+00:00
131,1605195358413688832,HeyBudie,"Tak perlu basa-basi, dia tahu kalau kamu sedang sepi.",157,1106,2022-12-20 13:36:11+00:00
132,1604872412549431296,HeyBudie,Jadi kelihatan kalau yang berharap cuma diri sendiri.,1894,7493,2022-12-19 16:12:54+00:00
133,1604847105637371904,HeyBudie,"Semakin diharapkan
semakin diabaikan.",2277,8096,2022-12-19 14:32:21+00:00
134,1604807805868773376,HeyBudie,Dia tidak pergi juga tidak ingin menemani.,1254,5460,2022-12-19 11:56:11+00:00
135,1604702530843291648,HeyBudie,"Piala dunia tiba-tiba kelar, kamu tiba-tiba hilang tanpa kabar.",344,2186,2022-12-19 04:57:51+00:00
136,1604496938811805696,HeyBudie,"Nggak diblock, tapi nggak bisa diajak ngobrol.",2450,10757,2022-12-18 15:20:54+00:00
137,1604435012731822080,HeyBudie,"Dibaca lewat notif, dibalas lewat hati.",2820,13089,2022-12-18 11:14:50+00:00
138,1604349267446882304,HeyBudie,Gapapa kan kalau dia milih dekat dengan yang lain?,1281,12022,2022-12-18 05:34:07+00:00
139,1604160878852521984,HeyBudie,Ujungnya ketemu dengan yang namanya lost contact.,1678,7447,2022-12-17 17:05:32+00:00
140,1604140845946392578,HeyBudie,"Sengaja nggak ngasih kabar, dia mau menghindar.",541,3759,2022-12-17 15:45:55+00:00
141,1604081830428176384,HeyBudie,"Dia maunya ditemani, bukan dimiliki.",3816,17384,2022-12-17 11:51:25+00:00
142,1604036716666716160,HeyBudie,Padahal dia ngode juga bukan buat kamu.,685,5142,2022-12-17 08:52:09+00:00
143,1603747795214561282,HeyBudie,"Ngechatnya sekali, giliran dibalas malah nggak ada kelanjutannya lagi.",791,5678,2022-12-16 13:44:05+00:00
144,1603693586066812928,HeyBudie,"Tiba-tiba menjauh begitu saja, ternyata ada hati yang harus ia jaga.",1704,8803,2022-12-16 10:08:40+00:00
145,1603629057328836608,HeyBudie,Nggak semua yang selesai harus diulangi.,1665,7358,2022-12-16 05:52:15+00:00
146,1603424229998764032,HeyBudie,"Sudah bikin pusing, sekarang malah asing.",958,4646,2022-12-15 16:18:21+00:00
147,1603358803310743554,HeyBudie,"Dia mendekati karena takut sepi, bukan jatuh hati.",2594,13204,2022-12-15 11:58:22+00:00
148,1603243856572477442,HeyBudie,"Kamu yang sengaja pergi, kamu juga yang bingung mencari.",838,4689,2022-12-15 04:21:36+00:00
149,1603041328396324865,HeyBudie,Padahal dia juga tidak memintamu untuk menunggu.,2699,11578,2022-12-14 14:56:50+00:00
150,1602958189796134913,HeyBudie,"Dikira dia kembali untuk menemani, ternyata cuma membuat luka lagi.",635,3452,2022-12-14 09:26:28+00:00
151,1602918218577879040,HeyBudie,"Dia tahu kalau kamu suka, tapi dia tetap ingin dengan yang lainnya.",1402,7912,2022-12-14 06:47:38+00:00
152,1602695024193306625,HeyBudie,"Nyaman sendiri, tapi nggak ingin sepi.",1802,7629,2022-12-13 16:00:45+00:00
153,1602678792358481920,HeyBudie,Gampang banget capek badan dan pikiran.,273,1069,2022-12-13 14:56:15+00:00
154,1602667660252434433,HeyBudie,Meski kamu pergi dengan sengaja juga nggak ngaruh apa-apa ke dia.,395,2165,2022-12-13 14:12:00+00:00
155,1602647334009053185,HeyBudie,"Kamu yang mengobati, dia malah kembali ke orang yang menyakiti.",446,2868,2022-12-13 12:51:14+00:00
156,1602535444733841414,HeyBudie,"Kurangi terlalu berharap, kan kamu nggak dianggap.",3114,12036,2022-12-13 05:26:38+00:00
157,1602355263800909824,HeyBudie,Malam yang sunyi bersama isi kepala yang berisik.,1854,5675,2022-12-12 17:30:39+00:00
158,1602348218808795136,HeyBudie,"Bukannya males nanggepi, kan emang lebih suka ngomong sendiri.",198,1271,2022-12-12 17:02:40+00:00
159,1602277614999113730,HeyBudie,Kangen meski bukan siapa-siapanya.,1336,5844,2022-12-12 12:22:06+00:00
160,1601973721161293824,HeyBudie,"Fotonya disimpan, kangennya dipendam.",2720,10967,2022-12-11 16:14:33+00:00
161,1601945623493689345,HeyBudie,"Sudah tahu dia nggak bakal ada rasa, masih saja kamu paksa.",1256,6572,2022-12-11 14:22:54+00:00
162,1601842041960337408,HeyBudie,"Kuat banget kamu
gapapa mulu.",2553,10023,2022-12-11 07:31:18+00:00
163,1601817484268478464,HeyBudie,"Denganmu dia merasa senang, tapi tidak menemukan rasa nyaman.",312,1799,2022-12-11 05:53:43+00:00
164,1601618033000452096,HeyBudie,"Selalu menjadi tempat cerita orang lain, tapi dirinya merasa nggak punya tempat cerita.",1675,5793,2022-12-10 16:41:10+00:00
165,1601536833049202688,HeyBudie,"Meski dia merasa sepi, berharapnya juga bukan kamu yang menemani.",367,2123,2022-12-10 11:18:30+00:00
166,1601491354311278593,HeyBudie,Sudah sat-set malah lost contact lebih cepet.,663,4485,2022-12-10 08:17:47+00:00
167,1601451839790071809,HeyBudie,"Seketika panikku hilang, karena ingat kalau ada Paket Darurat Telkomsel! Langsung sat-set aktifin #Darurat505 dan a… https://t.co/ixiy0wyGyw",2,23,2022-12-10 05:40:46+00:00
168,1601444459928952833,HeyBudie,"Ada yang janjian datangnya lebih cepat, ada yang janjian datang terlambat
Paling males kalau disuruh nunggu, apalag… https://t.co/xAPrCZJZJL",30,229,2022-12-10 05:11:27+00:00
169,1601224321229238273,HeyBudie,"Berharap dikabari lagi, padahal sudah tahu kalau nggak mungkin terjadi.",932,4398,2022-12-09 14:36:42+00:00
170,1601210931799035904,HeyBudie,"Masih sering terlihat, tapi sudah tak saling chat.",309,2152,2022-12-09 13:43:29+00:00
171,1601190248293158912,HeyBudie,"Kamu sengaja berpaling, padahal dia nggak pernah menganggap kamu penting.",389,2311,2022-12-09 12:21:18+00:00
172,1600881951593807872,HeyBudie,"Nggak semua harus kamu tahu, daripada menyakitimu.",1199,5411,2022-12-08 15:56:14+00:00
173,1600847033119936520,HeyBudie,"Kalau nggak ngobrol sama diri sendiri, ya ngobrol sama kucing meski nggak ditanggapi.",959,4405,2022-12-08 13:37:29+00:00
174,1600515606373015552,HeyBudie,"Males ngobrol, tapi nggak mau kesepian.",1297,6243,2022-12-07 15:40:31+00:00
175,1600497100714053633,HeyBudie,"Sendiri nyaman, berdua tak kesampaian.",777,4625,2022-12-07 14:26:59+00:00
176,1600476202208096256,HeyBudie,Samar-sama lalu ia menghindar.,166,1108,2022-12-07 13:03:56+00:00
177,1600167160499752970,HeyBudie,"Inginnya juga bahagia, tenang tanpa harus kepikiran.",483,1999,2022-12-06 16:35:55+00:00
178,1600120157522624513,HeyBudie,"Masih aja mengejar dia, padahal nggak pernah dianggap ada.",693,4135,2022-12-06 13:29:09+00:00
179,1600023362784198656,HeyBudie,Satu persatu yang pernah dekat akan menjadi jauh.,1211,5385,2022-12-06 07:04:31+00:00
180,1599783153530376193,HeyBudie,"Tetap kamu nanti, padahal dia sudah nggak peduli.",259,1564,2022-12-05 15:10:00+00:00
181,1599741128076447744,HeyBudie,Belum sembuh malah dapat luka baru.,1555,6027,2022-12-05 12:23:01+00:00
182,1599632974697631744,HeyBudie,"Meski terlihat tidak mungkin, tapi masih tetap kamu harapin.",1080,4752,2022-12-05 05:13:15+00:00
183,1599406387330965504,HeyBudie,Yang kamu suka malah bercerita orang yang dia suka.,340,2837,2022-12-04 14:12:52+00:00
184,1599376613371965441,HeyBudie,Nunggu dia ada perlu biar dia fast respon ke kamu.,175,1306,2022-12-04 12:14:34+00:00
185,1599362689645817856,HeyBudie,Yang dilihat orang lain hanya enak-enak saja. Aslinya malah stres.,1102,4229,2022-12-04 11:19:14+00:00
186,1599337916542889984,HeyBudie,Masih kamu tunggu yaa meski dia sudah dengan yang lainnya.,403,2737,2022-12-04 09:40:48+00:00
187,1599064546676965376,HeyBudie,Jangan terlalu berharap dia akan melibatkan rasa.,541,3376,2022-12-03 15:34:31+00:00
188,1599031174718197763,HeyBudie,"Nggak berani mengulang, karena yang kemarin nggak ada balasan.",564,2998,2022-12-03 13:21:55+00:00
189,1598892048425586690,HeyBudie,"Inginnya bodo amat, tapi malah jadi kepikiran.",935,4396,2022-12-03 04:09:04+00:00
190,1598712609892880384,HeyBudie,"Kemarin hangat seakan terpikat, sekarang dingin seakan tak ingin.",1981,7864,2022-12-02 16:16:03+00:00
191,1598659705827602433,HeyBudie,"Balasnya nggak lama, cuma bukan yang diharapkan saja.",162,1054,2022-12-02 12:45:50+00:00
192,1598602596658581505,HeyBudie,"Masih kamu dekati, meski tahu kalau dia nggak bisa dimiliki.",423,2673,2022-12-02 08:58:54+00:00
193,1598529182371557377,HeyBudie,"Di saat mulai suka, gataunya dia sudah ada yang punya.",336,2674,2022-12-02 04:07:10+00:00
194,1598343815328169984,HeyBudie,"Di luar tertawa riang, sampai rumah balik mode pabrik.",1046,4714,2022-12-01 15:50:36+00:00
195,1598286420434554880,HeyBudie,"Kan nggak semua suka dibalas suka, ada yang didiemin saja.",547,3240,2022-12-01 12:02:32+00:00
196,1598186595055640576,HeyBudie,"Tau-tau Desember, tau-tau cuma kamu yang baper.",326,2142,2022-12-01 05:25:51+00:00
197,1597973257948639232,HeyBudie,"Jangankan ditunggu, diharap saja tidak.",496,2237,2022-11-30 15:18:08+00:00
198,1597837995906043904,HeyBudie,Sering kali kesal dengan ekspektasi diri sendiri.,1702,5039,2022-11-30 06:20:39+00:00
199,1597631940940947456,HeyBudie,"Nunggunya lama, perginya begitu saja.",450,2285,2022-11-29 16:41:51+00:00
